,title,description
2327,"
Joel Embiid finds himself in the fourth quarter, now 76ers find themselves going against Knicks
",Philadelphia came from behind and held on to beat the Miami Heat 105-104 and advance as the No. 7 seed.
2328,"
Joel Embiid scores 23 points, has the big assist as 76ers beat Heat in play-in to earn No. 7 seed
",76ers earned the No. 7 seed and advanced to play the second-seeded New York Knicks.
2329,"
Report: Walt Anderson stepping down as NFL senior V.P. of officiating
",The NFL is in search of a new senior vice president of officiating. 
2330,"
Baby on board: Bubba and Amanda Wallace announce they are expecting first child
",Bubba Wallace is latest NASCAR driver who will see their family expand this year.
2331,"
Leonard Williams interrupted his Tokyo vacation to sign his contract with Seattle
","Defensive tackle Leonard Williams was vacationing in Japan when his agent let him know they had agreed to a three-year, $64.5 million deal for him to return to the Seahawks. "
2332,"
Ali Marpet: Tom Brady offered cash incentives for successful screen passes
",Tom Brady’s time in Tampa Bay was largely successful. 
2333,"
Washington’s decision to bring in four top quarterbacks at once makes no sense
","It was comical, to say the least, to see some in the media twist themselves into knots to praise the Commanders for bringing four top quarterback prospects in for a visit on the same day. "
2334,"
Potential Champions League Finals: Subplots a-plenty (despite Man City, Arsenal exits)
",Which of the four possible UEFA Champions League Final match-ups in London would be the most interesting?
2335,"
Are Patriots paying Bill Belichick $25 million this year?
",Significant claim buried in ESPN.com article isn’t accurate.
2336,"
RB J.K. Dobbins agrees to one-year deal with Chargers
",Free agent running back J.K. 
2337,"
Free agent RB Rashaad Penny visited Seahawks 
",Free agent running back Rashaad Penny visited Seattle on Wednesday. 
2338,"
Australian swimmer Emma McKeon plans to make Paris her final Olympics
","Emma McKeon, who won seven medals in Tokyo, plans to end her Olympic career in Paris."
2339,"
Jalen Ramsey is working out on his own, and fully healthy, he has big offseason plans
",Dolphins cornerback Jalen Ramsey is working out on his own at his home in Tennessee. 
2340,"
Capitals top prospect Ryan Leonard is returning to Boston College
","The 6-foot, 192-pound winger could have become the latest young player to jump right in at hockey’s highest level in the postseason."
2341,"
Bill Belichick: Media reports on players’ draft stock come from their agents, not teams
","Bill Belichick will be working in the media, rather than for a team, during next week’s NFL draft. "
2342,"
Manchester City 1-1 Real Madrid: Defending champs out in penalties
","“To beat Real Madrid, we had to perform our best,” Pep Guardiola said. “We were our best but it was not enough.”"
2343,"
Bayern Munich 1-0 Arsenal: Gunners exit Champions League
","Joshua Kimmich scored the lone goal to send the Bavarians to the semifinal, as Arsenal exit the competition at the quarterfinal stage."
2344,"
Rashee Rice back catching passes from Patrick Mahomes in Texas
","Chiefs receiver Rashee Rice is participating in the team’s voluntary offseason program, which is virtual until practice begins May 20. "
2345,"
Mikel Arteta: Arsenal ‘lacked the magic to unlock the game’ in Champions League exit
","“We lacked the magic to unlock the game and open that door,” Arteta said after the loss to Bayern Munich. “That’s why we are out.”"
2346,"
Tyler Linderbaum not worried about Ravens offensive line chemistry after offseason changes
","Ravens center Tyler Linderbaum only has two NFL seasons under his belt, but he’s set to take on a bigger leadership role in Baltimore this season. "
2347,"
RBC Heritage Best Bets 
",Brad Thomas is on a heater cashing back-to-back outright tickets. He’s back hoping to hit his third in a row for the RBC Heritage. 
2348,"
Browns put Justin Murray on reserve/retired list
","Offensive lineman Justin Murray signed a futures contract with the Browns in January, but he won’t be continuing to try to make the team. "
2349,"
What’s next for Warriors? Klay Thompson “open” to testing free agent market, Chris Paul isn’t retiring
","Whatever the Golden State Warriors look like next season, it will be different than the one that lost to the Kings Tuesday."
2350,"
Dolphins sign Cam Brown
",The Dolphins made an addition to their defense and special teams on Wednesday. 
2351,"
Terry McDonough’s lawyer suggests NFL covered up Cardinals’ violation of Steve Keim suspension
","Tuesday’s interview of Terry McDonough’s lawyer, Mike Caspino, on Doug Franz Unplugged included plenty of eyebrow-raising allegations. "
2352,"
For one week only, get Father of Mine for 99 cents
",It’s tax day. 
2353,"
Albany edge rusher AJ Simon, a draft prospect, has died at 25
","Albany pass rusher Amitral “AJ” Simon has died, the school announced Wednesday. "
2354,"
Report: Darius Slayton wants a new deal, isn’t at voluntary workouts
",The Giants may be adding a new wide receiver to the roster early in next week’s draft and one of their current ones is reportedly unhappy with his current deal. 
2355,"
NCAA fast tracks rule change to make multi-time transfers immediately eligible, matching court order
",NCAA athletes will be immediately eligible to play no matter how many times they transfer — as long as they meet academic requirements — after the association fast-tracked legislation Wednesday to fall in line with a recent court order. 
2356,"
UTEP QB Gavin Hardison visiting the Packers today
","University of Texas at El Paso quarterback Gavin Hardison is on a pre-draft visit in Green Bay today, Tom Pelissero of NFL Media reports. "
2357,"
Man charged in transport of Masters memorabilia taken from Augusta National
",A man has been charged in federal court in Illinois in the transport of millions of dollars worth of Masters Tournament merchandise and memorabilia stolen from ANGC.
2358,"
Noah Lyles, Gabby Thomas headline USA Track and Field team for World Athletics Relays
",World Relays take place in the Bahamas from May 4-5.
2359,"
Former Michigan center Tarris Reed Jr. announces he is transferring to UConn
",The 6-foot-10 sophomore averaged 9.0 points and 7.2 rebounds this past season.
2360,"
Georgia TE Brock Bowers meeting with Chargers today
","Georgia tight end Brock Bowers is visiting with the Chargers today, Adam Schefter of ESPN reports. "
2361,"
PGA Tour Enterprises board meets at RBC Heritage
","The board of directors met Tuesday at the RBC Heritage for nearly four hours, according to various sources."
2362,"
NASCAR Best Bets: GEICO 500
",Elliott looking to go back-to-back at Talladega
2363,"
After hitting up dive bar after Masters, Scottie Scheffler back at in action at RBC Heritage
",Scheffler made a late-night detour to a Dallas dive bar called Inwood Tavern early Monday morning following his second consecutive victory at Augusta National.
2364,"
Cam Jurgens: I’m not trying to replace Jason Kelce, just trying to be best version of me
","Before Cam Jurgens can get comfortable taking over Jason Kelce’s former spot as the center for the Eagles, he has to get used to taking over Kelce’s spot in the locker room. "
2365,"
Chase Brown has invested in his health as he prepares for a bigger role in Cincinnati
","As a rookie last season, Bengals running back Chase Brown was a backup to Joe Mixon and finished the season with just 44 carries for 179 yards and no touchdowns. "
2366,"
Former Lions CB Cameron Sutton enters pretrial diversion program on battery charge
",Former Lions cornerback Cameron Sutton has reached a legal resolution on the battery charge that led to his release from the team last month. 
2367,"
Zion Williamson out for play-in game vs. Kings due to left hamstring injury
","He will be re-evaluated in two weeks, meaning he would be out for the start of a playoff series if the Pelicans advance."
2368,"
Roquan Smith: Derrick Henry addition is huge, will help us stick to what we do
",The Ravens think they acquired a difference-maker when Derrick Henry arrived in Baltimore.
2369,"
Rex & Lav Pod: Rory report, Scottie’s start highlight post-Masters news
","Talking Scottie, Rory, the Heritage and Nelly at the Chevron Championship."
2370,"
Furyk still unsure of Tiger’s role on U.S. Prez Cup team
",Tiger Woods suggested last week at the Masters that his future as a potential U.S. Ryder Cup captain for next year’s matches will be made soon.
2371,"
Drivers to watch in Sunday’s Cup race at Talladega
",Ryan Blaney has finished first or second in the last three Talladega races.
2372,"
Bill Belichick to co-host Pat McAfee’s ESPN+ NFL draft show
",Bill Belichick has his first job since leaving New England. 
2373,"
Padres put Yu Darvish on 15-day injured list with neck stiffness
",The Padres made the retroactive move ahead of their game against the Brewers in Milwaukee.
2374,"
Bears hire Ted Crews as special advisor to Kevin Warren and chief administrative officer
",Ted Crews is taking his three Super Bowl rings to Halas Hall. 
2375,"
Nadal loses to De Minaur in second round at Barcelona following injury layoff
","Rafael Nadal, back from an injury layoff, looked like his old self for brief moments in the second-round match but couldn’t keep up with the 11th-ranked Alex De Minaur."
2376,"
2024 NFL Mock Draft: Rogers would take Penix over Daniels, McCarthy if he were GM
",Connor Rogers’ latest NFL mock draft takes a look at what he would do if he were in the GM chair for each team’s first selection.
2377,"
Stephen Williams becomes first British rider to win the Flèche Wallonne
",The 27-year-old Stephen Williams made his move with about 250 meters left to claim the biggest win of his career.
2378,"
Montreal Canadiens exercise option on coach Martin St. Louis’ contract
",Montreal hired Martin St. Louis on an interim basis following Dominique Ducharme’s dismissal in February 2022.
2379,"
Marc-Andre Fleury signs a $2.5M extension with the Wild to return for next season at age 40
",The Wild also have goalie Filip Gustavsson under contract and top prospect Jesper Wallstedt still waiting in the wings.
2380,"
Justin Verlander to make season debut for Astros on Friday night at Washington
",The three-time Cy Young Award winner opened the season on the injured list with inflammation in his right shoulder.
2381,"
NBA bans Raptors’ Jontay Porter for life due to involvement in betting on NBA games
",The league says Porter bet on NBA games himself and left at least one game early to help under prop bettors.
2382,"
NBA issues lifetime ban for Jontay Porter for gambling violations
",Jontay Porter’s NBA career is over. 
2383,"
Betting the NBA Play-In Games: Miami vs. Philadelphia 
",Embiid and Butler take center stage Tonight
2384,"
Bill Belichick reportedly told Falcons his key assistants are better soldiers than generals
",The lengthy item from ESPN.com that delves into the failure of former Patriots coach Bill Belichick to land a job in 2024 includes a claim regarding his effort to explain his affinity for a failed phalanx of former assistants. 
2385,"
Jalen Hurts in “sponge mode” learning new offense
","The Eagles made several changes to their coaching staff after the disappointing end to their 2023 season, including a move to hire a new offensive coordinator for the second straight season. "
2386,"
Inside Scottie Scheffler’s continual evolution in becoming indisputable mental giant
","Coming off his best emotional performance ever, two-time Masters champion Scottie Scheffler admits that kind of mindset has always been a “constant battle.”"
2387,"
Howie Roseman admits a bias in favor of drafting Eagles legacy Jeremiah Trotter Jr.
",The Eagles drafted linebacker Jeremiah Trotter Sr. in 1998 and he became a member of the team’s Hall of Fame. 
2388,"
Inside the latest DeForest Buckner deal
",Colts defensive lineman DeForest Bucker signed a two-year extension earlier this week. 
2389,"
Who are the UEFA Champions League scoring leaders?
",Erling Haaland and Kylian Mbappe are lethal... but about 100 goals back of Cristiano Ronaldo
2390,"
Browns going back to white facemasks full-time for the 2024 season 
",The Browns are tweaking their look for the 2024 season. 
2391,"
Drake Maye is off the board for team-specific bets at DraftKings
",Where will quarterback Drake Maye be drafted? 
2392,"
Olympic men’s basketball roster a Dream Team with LeBron James, Kevin Durant, Steph Curry
",The U.S. Olympic men’s basketball team goes for a fifth consecutive title in Paris.
2393,"
Jared Goff: Loss in NFC title game “gave us a ton of fire” for 2024
","The Lions’ 2023 season came to an end in the NFC Championship Game, when the team blew a 24-7 halftime lead to fall to the 49ers 34-31. "
2394,"
Bo Nix, Spencer Rattler visited Giants this week
","The Giants have spent time during the pre-draft process with the quarterbacks projected to get selected at the top of the first round, but their research didn’t stop there. "
2395,"
Troy Fautanu visiting Jets Wednesday
",One of the top offensive line prospects in this year’s draft class is wrapping up his pre-draft visits in the AFC East. 
2396,"
Patriots deny ESPN report that Robert Kraft told Arthur Blank not to trust Bill Belichick
",Pats dispute claim that Kraft torpedoed Belichick’s candidacy in Atlanta.
2397,"
Cooper DeJean visited with Steelers, Seahawks, Bills, Eagles
",Cornerback Cooper DeJean’s pre-draft schedule was a bit more difficult to navigate than those of other prospective first-round picks. 
2398,"
Trevor Lawrence: Experience of 2023 is a waste if we don’t use it, learn from it
","After getting off to an 8-3 start in 2023, the Jaguars lost five of their last six games to finish 9-8 and miss the playoffs. "
2399,"
Three takeaways from play-in games: Did we witness the official end of Warriors dynasty?
",Steve Kerr said ‘We need Klay back’ but what the Warriors need more is a secondary shot creator next to Stephen Curry.
2400,"
Mixing It Up: Max Fried’s sweeper, Cristian Javier’s changeup, more
",Eric Samulski breaks down four pitchers who are throwing new pitches to see if we should care.
2401,"
2024 Paris Olympics schedule: Highlights for every day of the Games
",The 2024 Paris Olympics Opening Ceremony is July 26 with medal competition running through Aug. 11.
2402,"
2024 Supercross Round 14, Nashville by the numbers: Will Jett Lawrence or Cooper Webb have solo red plate?
","A hard crash in Nashville last year ended Cooper Webb’s championship run. One year later, he could walk out of Nissan Stadium with sole possession of the red plate."
2403,"
Foye Oluokun: Last year’s late collapse will fuel Jaguars this season
","The Jaguars finished strong to win the AFC South in 2022, but history did not repeat itself in 2023. "
2404,"
100 days away: Women hopeful to represent countries at Paris Olympics
",The countdown is underway and players are battling for spots to represent their country at Le Golf National.
2405,"
Browns’ Greg Newsome heard trade rumors, but paid them no mind
","Browns cornerback Greg Newsome has frequently been mentioned as a player who could be traded, but Newsome says he puts it out of his mind. "
2406,"
Bobby Okereke expects “acclimation period” to hip-drop tackle ban
",Defensive players in the NFL have a new rule to contend with for the 2024 season. 
2407,"
Rachaad White wants to be player defenses “fear” and “respect” in new Tampa offense
","Last October, quarterback Baker Mayfield said the Bucs are “kind of learning that we’re not going to be a run-first team.” "
2408,"
DeVonta Smith: Good to have two receivers that want to be the alpha
",Eagles wide receiver DeVonta Smith signed a contract extension this week that ties him to the club through the 2028 season and getting that deal done means the Eagles have found a way to sign a pair of wideouts to long-term deals. 
2409,"
Good news, bad news for NASCAR Cup teams entering Talladega weekend
",Chase Briscoe’s recent run has the Stewart-Haas Racing driver in a playoff spot.
2410,"
Howie Roseman: Eagles filled needs in free agency so we can draft for talent, not need
","Eagles General Manager Howie Roseman views free agency as the time to address team needs, and the draft as the time to add the most talented players regardless of whether they play a position of need. "
2411,"
Sacramento eliminates Golden State from play-in tournament with 118-94 win
",Sacramento fans savored some payback after the Warriors knocked the Kings out of the playoffs last season. 
2412,"
Kings eliminate the Warriors from play-in tournament with 118-94 win
",The Sacramento Kings will play the New Orleans Pelicans for the No. 8 seed in the Western Conference.
2413,"
Chris Grier: Tua Tagovailoa is doing everything he can to be great
",Tua’s offseason efforts win praise from the Dolphins.
2414,"
Patrick Mahomes says he’s “nowhere near” GOAT status
","Patrick Mahomes has done a lot, but he hasn’t done enough to be considered the GOAT. "
2415,"
How to watch IMSA sports cars at Long Beach: Schedule, TV info, streaming, start times, more
",Strategy again is a likely focus for the 100-minute street race that was a tense battle between Porsche and Acura last year.
2416,"
Lakers hang on to beat Pelicans after Zion has to leave game late with injury
","Los Angeles will face Denver in the first round, Zion’s status for the second play-in game is not known."
2417,"
C.J. Stroud: John Metchie can be special
",C.J. 
2418,"
Aaron Plessinger out for remainder of 2024 Supercross with fractured elbow
","Aaron Plessinger crashed in Free Practice for Round 13 in Foxborough, Massachusetts and could not mount up for qualification."
2419,"
Cowboys sign RB Royce Freeman to a one-year deal
","The Cowboys signed running back Royce Freeman to a one-year deal Tuesday, Todd Archer of ESPN reports. "
2420,"
Seven teams in the top 13 could be looking at taking quarterbacks
",Will six quarterbacks be taken in round one for the first time since 1983? 
2421,"
Stephen Jones expresses confidence in Cowboys’ young OL
",Jerry Jones bought the Cowboys in 1989. 
2422,"
First team out of regionals, Washington State plays on at college golf’s NIT
","The second annual National Golf Invitational begins Friday in Maricopa, Arizona."
2423,"
The 30 teams, six individuals competing in NCAA Division I Men’s Golf Championship
","The 2024 championship will be held at Omni La Costa in Carlsbad, California."
2424,"
Jon Rahm nearly shoots self out of PGA – and then he doesn’t
",Rahm stormed back Thursday at Valhalla to salvage a 1-under 70.
2425,"
Alternates take advantage of Mizuho Americas withdrawals, including Rose Zhang’s
",Players who got into the field at the last minute Thursday took advantage of their opportunities.
2426,"
Unlucky 7 to close derails Phil Mickelson’s opening round at PGA
",Mickelson doubled Valhalla’s last hole to shoot 3-over 74 in his opening round Thursday at the PGA Championship.
2427,"
First team out of regionals, Washington State plays on at college golf’s NIT
","The second annual National Golf Invitational begins Friday in Maricopa, Arizona."
2428,"
The 30 teams, six individuals competing in NCAA Division I Men’s Golf Championship
","The 2024 championship will be held at Omni La Costa in Carlsbad, California."
2429,"
Jon Rahm nearly shoots self out of PGA – and then he doesn’t
",Rahm stormed back Thursday at Valhalla to salvage a 1-under 70.
2430,"
Alternates take advantage of Mizuho Americas withdrawals, including Rose Zhang’s
",Players who got into the field at the last minute Thursday took advantage of their opportunities.
2431,"
Unlucky 7 to close derails Phil Mickelson’s opening round at PGA
",Mickelson doubled Valhalla’s last hole to shoot 3-over 74 in his opening round Thursday at the PGA Championship.
2432,"
First team out of regionals, Washington State plays on at college golf’s NIT
","The second annual National Golf Invitational begins Friday in Maricopa, Arizona."
2433,"
The 30 teams, six individuals competing in NCAA Division I Men’s Golf Championship
","The 2024 championship will be held at Omni La Costa in Carlsbad, California."
2434,"
Jon Rahm nearly shoots self out of PGA – and then he doesn’t
",Rahm stormed back Thursday at Valhalla to salvage a 1-under 70.
2435,"
Alternates take advantage of Mizuho Americas withdrawals, including Rose Zhang’s
",Players who got into the field at the last minute Thursday took advantage of their opportunities.
2436,"
Unlucky 7 to close derails Phil Mickelson’s opening round at PGA
",Mickelson doubled Valhalla’s last hole to shoot 3-over 74 in his opening round Thursday at the PGA Championship.
2437,"
First team out of regionals, Washington State plays on at college golf’s NIT
","The second annual National Golf Invitational begins Friday in Maricopa, Arizona."
2438,"
The 30 teams, six individuals competing in NCAA Division I Men’s Golf Championship
","The 2024 championship will be held at Omni La Costa in Carlsbad, California."
2439,"
Jon Rahm nearly shoots self out of PGA – and then he doesn’t
",Rahm stormed back Thursday at Valhalla to salvage a 1-under 70.
2440,"
Alternates take advantage of Mizuho Americas withdrawals, including Rose Zhang’s
",Players who got into the field at the last minute Thursday took advantage of their opportunities.
2441,"
Unlucky 7 to close derails Phil Mickelson’s opening round at PGA
",Mickelson doubled Valhalla’s last hole to shoot 3-over 74 in his opening round Thursday at the PGA Championship.
2442,"
First team out of regionals, Washington State plays on at college golf’s NIT
","The second annual National Golf Invitational begins Friday in Maricopa, Arizona."
2443,"
The 30 teams, six individuals competing in NCAA Division I Men’s Golf Championship
","The 2024 championship will be held at Omni La Costa in Carlsbad, California."
2444,"
Jon Rahm nearly shoots self out of PGA – and then he doesn’t
",Rahm stormed back Thursday at Valhalla to salvage a 1-under 70.
2445,"
Alternates take advantage of Mizuho Americas withdrawals, including Rose Zhang’s
",Players who got into the field at the last minute Thursday took advantage of their opportunities.
2446,"
Unlucky 7 to close derails Phil Mickelson’s opening round at PGA
",Mickelson doubled Valhalla’s last hole to shoot 3-over 74 in his opening round Thursday at the PGA Championship.
2447,"
First team out of regionals, Washington State plays on at college golf’s NIT
","The second annual National Golf Invitational begins Friday in Maricopa, Arizona."
2448,"
The 30 teams, six individuals competing in NCAA Division I Men’s Golf Championship
","The 2024 championship will be held at Omni La Costa in Carlsbad, California."
2449,"
Jon Rahm nearly shoots self out of PGA – and then he doesn’t
",Rahm stormed back Thursday at Valhalla to salvage a 1-under 70.
2450,"
Alternates take advantage of Mizuho Americas withdrawals, including Rose Zhang’s
",Players who got into the field at the last minute Thursday took advantage of their opportunities.
2451,"
Unlucky 7 to close derails Phil Mickelson’s opening round at PGA
",Mickelson doubled Valhalla’s last hole to shoot 3-over 74 in his opening round Thursday at the PGA Championship.
2452,"
First team out of regionals, Washington State plays on at college golf’s NIT
","The second annual National Golf Invitational begins Friday in Maricopa, Arizona."
2453,"
The 30 teams, six individuals competing in NCAA Division I Men’s Golf Championship
","The 2024 championship will be held at Omni La Costa in Carlsbad, California."
2454,"
Jon Rahm nearly shoots self out of PGA – and then he doesn’t
",Rahm stormed back Thursday at Valhalla to salvage a 1-under 70.
2455,"
Alternates take advantage of Mizuho Americas withdrawals, including Rose Zhang’s
",Players who got into the field at the last minute Thursday took advantage of their opportunities.
2456,"
Unlucky 7 to close derails Phil Mickelson’s opening round at PGA
",Mickelson doubled Valhalla’s last hole to shoot 3-over 74 in his opening round Thursday at the PGA Championship.
2457,"
First team out of regionals, Washington State plays on at college golf’s NIT
","The second annual National Golf Invitational begins Friday in Maricopa, Arizona."
2458,"
The 30 teams, six individuals competing in NCAA Division I Men’s Golf Championship
","The 2024 championship will be held at Omni La Costa in Carlsbad, California."
2459,"
Jon Rahm nearly shoots self out of PGA – and then he doesn’t
",Rahm stormed back Thursday at Valhalla to salvage a 1-under 70.
2460,"
Alternates take advantage of Mizuho Americas withdrawals, including Rose Zhang’s
",Players who got into the field at the last minute Thursday took advantage of their opportunities.
2461,"
Unlucky 7 to close derails Phil Mickelson’s opening round at PGA
",Mickelson doubled Valhalla’s last hole to shoot 3-over 74 in his opening round Thursday at the PGA Championship.
2462,"
First team out of regionals, Washington State plays on at college golf’s NIT
","The second annual National Golf Invitational begins Friday in Maricopa, Arizona."
2463,"
The 30 teams, six individuals competing in NCAA Division I Men’s Golf Championship
","The 2024 championship will be held at Omni La Costa in Carlsbad, California."
2464,"
Jon Rahm nearly shoots self out of PGA – and then he doesn’t
",Rahm stormed back Thursday at Valhalla to salvage a 1-under 70.
2465,"
Alternates take advantage of Mizuho Americas withdrawals, including Rose Zhang’s
",Players who got into the field at the last minute Thursday took advantage of their opportunities.
